<?xml version="1.0" encoding="UTF-8"?>
<document xmlns:xsi="http://www.w3.org/2001/XMLSchema-instance" xsi:noNamespaceSchemaLocation="Schema3.xsd">
	<dimensions>
		<dimension>
			<name>Release</name>
			<tags><tag>1.4</tag><tag>5</tag></tags>
			<default>1.4</default>
		</dimension>
	</dimensions>
		<object xsi:type="Part">
			<data>blah blah</data>
			<subObjects>
			<object xsi:type="Variable">
				<name>Test</name>
			</object>
			</subObjects>
		</object>
		
</document>
